{
  "version": "1.0",
  "min_app_version": "0.12.0",
  "updated": "2026-03-05T15:04:10Z",
  "plugins": [
    {
      "id": "command_manager",
      "name": "Command Manager",
      "version": "1.0.4",
      "description": "Run and manage commands on network devices",
      "author": "chibashr",
      "download_url": "https://github.com/chibashr/NetWORKS/releases/download/plugins/command_manager-1.0.4.zip",
      "min_app_version": "0.8.16",
      "changelog": [
        {
          "version": "1.0.4",
          "date": "2026-03-05",
          "changes": [
            "Improved placeholder support for command text and batch export filename templates, including case-insensitive aliases like {Alias} and {ip-address} based on device properties",
            "Clarified placeholder usage in Command Manager batch export UI"
          ]
        },
        {
          "version": "1.0.3",
          "date": "2025-05-16",
          "changes": [
            "Added command search functionality to quickly find commands",
            "Added support for running custom commands directly from the UI",
            "Implemented safety checks for non-show commands to prevent accidental configuration changes"
          ]
        },
        {
          "version": "1.0.2",
          "date": "2025-05-16",
          "changes": [
            "Fixed credential manager issues with device groups and subnets",
            "Added proper logger initialization to prevent UnboundLocalError",
            "Fixed TypeError: unhashable type: 'dict' bug in subnet credential handling"
          ]
        },
        {
          "version": "1.0.1",
          "date": "2025-05-16",
          "changes": [
            "Fixed device groups display in Command Manager",
            "Improved group handling with more robust device group detection",
            "Better error handling for different group structures"
          ]
        },
        {
          "version": "1.0.0",
          "changes": [
            "Initial release",
            "Support for running commands on network devices",
            "Credential management for devices",
            "Command output history and reporting",
            "Bulk command execution"
          ]
        }
      ],
      "sha256": "cbf5b3eec7d32f1dd3a3fef496d30702fd67deb0307fa0beab8c0eca2eda6dcb"
    },
    {
      "id": "device_connector",
      "name": "Device Connector",
      "version": "1.2.0",
      "description": "Adds a Connect submenu to open SSH, Telnet, VNC, RDP, HTTP, HTTPS, or FTP as links; the system decides how to open them (like FTP).",
      "author": "chibashr",
      "download_url": "https://github.com/chibashr/NetWORKS/releases/download/plugins/device_connector-1.2.0.zip",
      "min_app_version": "0.8.16",
      "changelog": [
        {
          "version": "1.2.0",
          "date": "2026-01-29",
          "changes": [
            "Removed Web option; use HTTP and HTTPS only",
            "All connection types open as links (ssh://, telnet://, etc.); system decides handler",
            "Removed executable path settings; only default ports configurable"
          ]
        },
        {
          "version": "1.1.0",
          "date": "2026-01-29",
          "changes": [
            "Added WEB, RDP, HTTP, HTTPS, FTP connection types",
            "Plugin list icon (device_connector.svg)",
            "Authentication in launched app; removed SSH username from settings",
            "Filepath settings: '...' browse button for executable paths"
          ]
        },
        {
          "version": "1.0.0",
          "date": "2026-01-29",
          "changes": [
            "Initial release",
            "Connect submenu on device table context menu (SSH, Telnet, VNC, Web)",
            "User-configurable executable paths and default ports",
            "Default app detection for Windows (OpenSSH, PuTTY, Edge, VNC Viewer)"
          ]
        }
      ],
      "sha256": "f3506353c03017a7907783352142fefd84d4b15252faaca9e61ba44dec6ab782"
    },
    {
      "id": "network_scanner",
      "name": "Network Scanner",
      "version": "10.8",
      "description": "A plugin that scans the network for devices and adds them to NetWORKS",
      "author": "chibashr",
      "download_url": "https://github.com/chibashr/NetWORKS/releases/download/plugins/network_scanner-10.8.zip",
      "min_app_version": "0.8.16",
      "changelog": [
        {
          "version": "10.8",
          "date": "2026-02-14",
          "changes": [
            "Removed splitter from dock; top group renamed to Scan Settings"
          ]
        },
        {
          "version": "10.7",
          "date": "2026-02-14",
          "changes": [
            "Results panel renamed to Logs; reduced margins and smaller text in logs area; removed separator between progress bar and logs"
          ]
        },
        {
          "version": "10.6",
          "date": "2026-02-13",
          "changes": [
            "Scan and Results panels use QGroupBox instead of CollapsibleSection"
          ]
        },
        {
          "version": "10.5",
          "date": "2026-01-27",
          "changes": [
            "Fixed subnet determination from interface when Start Scan uses the interface combo display text",
            "Replaced target-selection radio buttons with a single Target dropdown in panel and scan dialog",
            "Removed OS Detection and Port Scanning toggles; scan behavior is defined by profile/scan-type arguments only",
            "Chunked range scanning with status updates (e.g. Scanning 192.168.1.0/28 (1/16)) and devices added to the table as they are found",
            "Table refresh after each new device during nmap range scans for incremental feedback"
          ]
        },
        {
          "version": "10.4",
          "date": "2026-01-26",
          "changes": [
            "Major improvements to nmap detection and integration",
            "Enhanced nmap detection to check multiple locations including common Windows installation paths",
            "Improved nmap executable verification to ensure it actually works before reporting availability",
            "Added support for detecting nmap.exe on Windows systems",
            "Implemented PATH management to ensure python-nmap can find nmap even when not in system PATH",
            "Added actual functionality testing to verify python-nmap can execute nmap",
            "Improved error handling and logging for nmap detection failures",
            "Updated error messages to be more helpful for users",
            "ScannerWorker now receives and uses nmap path for better compatibility"
          ]
        },
        {
          "version": "1.2.4",
          "date": "2026-01-26",
          "changes": [
            "Improved nmap detection to check multiple locations including common Windows installation paths",
            "Enhanced nmap executable verification to ensure it actually works before reporting availability",
            "Added support for detecting nmap.exe on Windows systems",
            "Improved error handling and logging for nmap detection failures",
            "Updated error messages to be more helpful for users"
          ]
        },
        {
          "version": "1.2.3",
          "date": "2025-05-28",
          "changes": [
            "Fixed critical bug: Only add devices that actually return data during a scan",
            "Improved filtering to exclude non-responsive hosts from scan results",
            "Added verification of host status before adding to inventory"
          ]
        },
        {
          "version": "1.2.2",
          "date": "2025-05-27",
          "changes": [
            "Fixed stop scan functionality to properly terminate nmap processes",
            "Added real-time status updates during scanning for better feedback",
            "Added new Quick Ping scan option that's faster than nmap for simple discovery",
            "Improved progress feedback with detailed status messages during scans"
          ]
        },
        {
          "version": "1.2.1",
          "date": "2025-05-26",
          "changes": [
            "Fixed critical bug causing nmap to time out due to duplicate scan arguments",
            "Improved argument handling to prevent duplicated command-line options"
          ]
        },
        {
          "version": "1.2.0",
          "date": "2025-05-25",
          "changes": [
            "Modified scan button to directly run scan with current panel settings",
            "Added new 'Advanced...' button to open the full scan dialog",
            "Fixed nmap timeout issues on new installations by increasing default timeout values",
            "Added -T4 timing template to scan profiles to improve scan speed",
            "Improved error handling for scan timeouts with more helpful messages"
          ]
        },
        {
          "version": "1.1.9",
          "date": "2025-05-24",
          "changes": [
            "Fixed import error for QIntValidator in plugin manager dialog",
            "Corrected Qt module imports to ensure proper functionality"
          ]
        },
        {
          "version": "1.1.8",
          "date": "2025-05-23",
          "changes": [
            "Fixed error when opening profile editor from plugin manager dialog",
            "Implemented custom profile editor in the plugin manager UI",
            "Improved user experience for managing scan profiles"
          ]
        },
        {
          "version": "1.1.7",
          "date": "2025-05-22",
          "changes": [
            "Fixed error when accessing plugin methods from settings dialog",
            "Added safe method forwarding for plugin settings pages",
            "Improved dialog handling to prevent missing method errors"
          ]
        },
        {
          "version": "1.1.6",
          "date": "2025-05-21",
          "changes": [
            "Fixed JSON settings display in plugin manager dialog",